{
  "version": "0.14.0",
  "observed": "2026-10-11",
  "research_status": "VERIFIED-2026-10-11 — identity resolved per research report; Spotify artist-linked via official SoundCloud bio; SoundCloud full catalog (185 tracks) verified via read-only live-browser pass 2026-10-11",
  "artist": {
    "name": "Aster da Master",
    "tagline": "He transcends music.",
    "genre": "Filed under Hip-Hop/Rap by distributors; his world is the digicore underground",
    "bio": "Aster Da Master is an underground, internet-native artist active since 2017.",
    "bio_paragraphs": [
      "Aster Da Master is an underground, internet-native artist active since 2017. Distributors file him under Hip-Hop/Rap — and under Alternative and even Pop — but his world is the digicore underground: melodic, internet-raised, and unmistakably his own.",
      "No interviews, press features, or official bios exist anywhere we have found, so this archive is built strictly from verified distributor and platform records. The catalog tells the story: a WoT label era in 2019 with the album Master Key; a prolific 2020 run of four projects; the Cast It: years of 2021–2022; the SomeLowLifes collective era of 2023–2024; a quiet 2025; and a comeback singles run through spring 2026.",
      "His titles read like incantations — Cast Out, Master Key, B4 the Ritual, Solstice, Bright — lowercase chaos and emoticons where you would expect gloss. Thirty-four releases across nine years, and he keeps moving. Real name, age, and hometown are not publicly known; this site invents nothing."
    ],
    "facts": [
      {
        "k": "Active since",
        "v": "2017"
      },
      {
        "k": "Releases on record",
        "v": "34 — 9 projects, 25 singles (2017–2026)"
      },
      {
        "k": "Collective",
        "v": "SomeLowLifes (somelowlifes label, 2023–2024)"
      },
      {
        "k": "Earlier label",
        "v": "WoT (2019)"
      },
      {
        "k": "Distributor tags",
        "v": "Hip-Hop/Rap · Alternative · Pop (Shazam) — distributor-applied"
      },
      {
        "k": "Scene",
        "v": "Underground digicore / melodic internet — a scene reading from collaborator evidence"
      },
      {
        "k": "2025",
        "v": "A quiet year — no releases found"
      },
      {
        "k": "Geography",
        "v": "Unknown; one track title hints at the Bay Area (single-source)"
      },
      {
        "k": "Press",
        "v": "None found — no interviews, bios, or features"
      },
      {
        "k": "Identity",
        "v": "Real name, age, hometown unknown — not invented here"
      }
    ]
  },
  "collaborators": [
    {
      "name": "Lil Wintr",
      "role": "Vocal feature"
    },
    {
      "name": "Marcelo",
      "role": "Vocal feature"
    },
    {
      "name": "Capoxxo",
      "role": "Vocal feature"
    },
    {
      "name": "Pvscale",
      "role": "Vocal feature · production"
    },
    {
      "name": "Lilvicbxi",
      "role": "Vocal feature"
    },
    {
      "name": "Jax",
      "role": "Vocal feature"
    },
    {
      "name": "Max Ferrari",
      "role": "Vocal feature"
    },
    {
      "name": "Lil Yu",
      "role": "Vocal feature"
    },
    {
      "name": "Offline Hp",
      "role": "Vocal feature"
    },
    {
      "name": "GRiiMXO",
      "role": "Vocal feature"
    },
    {
      "name": "AWFL",
      "role": "Vocal feature"
    },
    {
      "name": "DirtyDoves",
      "role": "Vocal feature"
    },
    {
      "name": "Lil' Spursy",
      "role": "Vocal feature"
    },
    {
      "name": "lilrareboy",
      "role": "Vocal feature",
      "confidence": "single-source"
    },
    {
      "name": "Memory Loaded October 600",
      "role": "Vocal feature",
      "confidence": "single-source"
    },
    {
      "name": "Falinee",
      "role": "Vocal feature",
      "confidence": "single-source"
    },
    {
      "name": "asa41",
      "role": "Production",
      "confidence": "single-source"
    },
    {
      "name": "razorwrist",
      "role": "Production",
      "confidence": "single-source"
    },
    {
      "name": "Willie G",
      "role": "Production",
      "confidence": "single-source"
    },
    {
      "name": "Lil' Flower",
      "role": "Production",
      "confidence": "single-source"
    },
    {
      "name": "SomeLowLifes",
      "role": "Collective · label (2020–2024)"
    },
    {
      "name": "WoT",
      "role": "Label (2019)"
    }
  ],
  "featured_release": {
    "title": "Living With The Big Shots",
    "date": "2026-05-05",
    "type": "Single",
    "blurb": "The latest transmission — six singles across spring 2026 close out his comeback run after a quiet 2025.",
    "links": [
      {
        "label": "Apple Music",
        "url": "https://music.apple.com/us/artist/aster-da-master/1466301103"
      },
      {
        "label": "iHeart",
        "url": "https://www.iheart.com/artist/aster-da-master-33038534/"
      }
    ]
  },
  "discography": [
    {
      "title": "Master Key",
      "date": "2019-12-23",
      "type": "Album",
      "tracks": 12,
      "links": [
        {
          "label": "Shazam",
          "url": "https://www.shazam.com/album/1491400265/master-key"
        },
        {
          "label": "Listen everywhere",
          "url": "https://album.link/s/1BdcF88a8MLKGgIqr7vvaM"
        }
      ],
      "label": "WoT",
      "artwork": "https://is1-ssl.mzstatic.com/image/thumb/Music113/v4/7a/2a/7a/7a2a7a69-39d0-091b-8da8-13ccb3f99e61/artwork.jpg/600x600bb.jpg",
      "source": "Apple Music profile 1466301103 (“Aster Da Master”) · iTunes Search API primary metadata · verified 2026-10-11"
    },
    {
      "title": "Soulless Soldiers",
      "date": "2019-12-30",
      "type": "Album",
      "tracks": 9,
      "links": [],
      "artwork": "https://is1-ssl.mzstatic.com/image/thumb/Music123/v4/1a/78/aa/1a78aa1f-dfa4-b92f-45b6-2b3f6bcdf4d0/artwork.jpg/600x600bb.jpg",
      "source": "Apple Music profile 1466301103 (“Aster Da Master”) · iTunes Search API primary metadata · verified 2026-10-11"
    },
    {
      "title": "Imagine All of This Without Pain",
      "date": "2020-06-07",
      "type": "Album",
      "tracks": 7,
      "links": [],
      "artwork": "https://is1-ssl.mzstatic.com/image/thumb/Music113/v4/78/6e/cc/786ecc73-4dfe-7177-76d6-acbeea4c9af6/artwork.jpg/600x600bb.jpg",
      "source": "Apple Music profile 1466301103 (“Aster Da Master”) · iTunes Search API primary metadata · verified 2026-10-11"
    },
    {
      "title": "Bright",
      "date": "2020-10-07",
      "type": "Album",
      "tracks": 11,
      "links": [],
      "artwork": "https://is1-ssl.mzstatic.com/image/thumb/Music124/v4/f5/08/b8/f508b835-5329-0caf-3eac-7d6e45a7a6ca/artwork.jpg/600x600bb.jpg",
      "source": "Apple Music profile 1466301103 (“Aster Da Master”) · iTunes Search API primary metadata · verified 2026-10-11"
    },
    {
      "title": "Solstice",
      "date": "2020-12-21",
      "type": "Album",
      "tracks": 8,
      "links": [],
      "artwork": "https://is1-ssl.mzstatic.com/image/thumb/Music124/v4/09/28/99/092899dc-ebcc-c0e6-8011-f8cfd3b7aab2/artwork.jpg/600x600bb.jpg",
      "source": "Apple Music profile 1466301103 (“Aster Da Master”) · iTunes Search API primary metadata · verified 2026-10-11"
    },
    {
      "title": "Cast It:, Pt. 1",
      "date": "2021-07-14",
      "type": "Album",
      "tracks": 16,
      "links": [],
      "artwork": "https://is1-ssl.mzstatic.com/image/thumb/Music125/v4/ce/9a/68/ce9a6888-aa70-fcb2-6895-d5f4d09a942a/artwork.jpg/600x600bb.jpg",
      "source": "Apple Music profile 1466301103 (“Aster Da Master”) · iTunes Search API primary metadata · verified 2026-10-11"
    },
    {
      "title": "Cast It:, Pt. 2",
      "date": "2022-02-22",
      "type": "Album",
      "tracks": 12,
      "links": [],
      "artwork": "https://is1-ssl.mzstatic.com/image/thumb/Music116/v4/3b/ed/ba/3bedba20-6340-0e4d-28e7-22893ec81e94/artwork.jpg/600x600bb.jpg",
      "source": "Apple Music profile 1466301103 (“Aster Da Master”) · iTunes Search API primary metadata · verified 2026-10-11"
    },
    {
      "title": "B4 the Ritual (2018)",
      "date": "2023-11-11",
      "type": "Album",
      "tracks": 12,
      "links": [],
      "label": "somelowlifes",
      "artwork": "https://is1-ssl.mzstatic.com/image/thumb/Music126/v4/1f/48/9a/1f489af1-ab4d-aefe-a9d9-310f23694d15/artwork.jpg/600x600bb.jpg",
      "source": "Apple Music profile 1466301103 (“Aster Da Master”) · iTunes Search API primary metadata · verified 2026-10-11"
    },
    {
      "title": "Cast Out",
      "date": "2023-11-11",
      "type": "Album",
      "tracks": 11,
      "links": [],
      "label": "somelowlifes",
      "artwork": "https://is1-ssl.mzstatic.com/image/thumb/Music116/v4/3e/aa/0c/3eaa0ce4-dd4f-0b09-b72b-152e536e38e2/artwork.jpg/600x600bb.jpg",
      "source": "Apple Music profile 1466301103 (“Aster Da Master”) · iTunes Search API primary metadata · verified 2026-10-11"
    },
    {
      "title": "lost memories (feat. Aster Da Master)",
      "date": "2017-04-20",
      "type": "Single",
      "links": [],
      "note": "Feature credit on another artist's single; earliest trace found.",
      "artwork": "https://is1-ssl.mzstatic.com/image/thumb/Music126/v4/cd/ba/ef/cdbaefbd-a605-78e9-1c73-3195c2e9a38a/artwork.jpg/600x600bb.jpg",
      "source": "Apple Music profile 1466301103 (“Aster Da Master”) · iTunes Search API primary metadata · verified 2026-10-11"
    },
    {
      "title": "Contact!",
      "date": "2019-09-21",
      "type": "Single",
      "links": [],
      "artwork": "https://is1-ssl.mzstatic.com/image/thumb/Music123/v4/e3/b5/89/e3b589db-189c-5c26-1ed0-1856088e1c47/artwork.jpg/600x600bb.jpg",
      "source": "Apple Music profile 1466301103 (“Aster Da Master”) · iTunes Search API primary metadata · verified 2026-10-11"
    },
    {
      "title": "Master Key (feat. Lil Wintr & Marcelo)",
      "date": "2019-12-06",
      "type": "Single",